{
  "schema_version": 1,
  "id": "grant-file-1",
  "owner_id": "user-1",
  "scope": "file",
  "scope_id": "library-item-1",
  "label": "Invoice.pdf",
  "permissions": ["model.read"],
  "status": "active",
  "resource_bindings": [
    {
      "library_item_id": "library-item-1",
      "sha256": "aaaaaaaaaaaaaaaaaaaaaaaaaaaaaaaaaaaaaaaaaaaaaaaaaaaaaaaaaaaaaaaa"
    }
  ],
  "risk_acknowledged_at": null,
  "expires_at": null,
  "revoked_at": null,
  "last_used_at": null,
  "created_at": "2026-08-04T13:00:00Z",
  "updated_at": "2026-08-04T13:00:00Z"
}
